{
  "id": "2026-04-13T20-16-04-e3b0c442",
  "created_at": "2026-04-13T20:16:04.972251Z",
  "mental_model": "mental-models.md",
  "scope": "view",
  "owner_name": "artifact-key",
  "view_script_hash": "0ee97fbe6b9467336092a2905c8d0a9f77b7f0f3",
  "diff_entries": [
    {
      "section_path": "$.sections[\"ArtifactKey Record\"]",
      "offset": 0,
      "source_files": [
        {
          "repo_path": "multi_agent_ide_java_parent/acp-cdc-ai/src/main/java/com/hayden/acp_cdc_ai/acp/events/ArtifactKey.java",
          "content_hash": "eb9de2dc9653cbd6c62192c47029c8ecb8284d81",
          "snapshot_path": "multi_agent_ide_java_parent/acp-cdc-ai/src/main/java/com/hayden/acp_cdc_ai/acp/events/ArtifactKey.java",
          "line_span": null
        },
        {
          "repo_path": "multi_agent_ide_java_parent/acp-cdc-ai/src/main/java/com/hayden/acp_cdc_ai/acp/events/HasContextId.java",
          "content_hash": "e1796f2512b050625633bd5e6aa00d6e5d9d0adb",
          "snapshot_path": "multi_agent_ide_java_parent/acp-cdc-ai/src/main/java/com/hayden/acp_cdc_ai/acp/events/HasContextId.java",
          "line_span": null
        }
      ],
      "supersedes": {
        "metadata_file_id": "2026-04-13T20-16-04-e3b0c442",
        "section_path": "$.sections[\"ArtifactKey Record\"]"
      }
    },
    {
      "section_path": "$.sections[\"Key-to-Node Mapping\"]",
      "offset": 0,
      "source_files": [
        {
          "repo_path": "multi_agent_ide_java_parent/multi_agent_ide/src/main/java/com/hayden/multiagentide/model/nodes/GraphNode.java",
          "content_hash": "5dd443f61d327b8f0fe34e82db341ddcf624d510",
          "snapshot_path": "multi_agent_ide_java_parent/multi_agent_ide/src/main/java/com/hayden/multiagentide/model/nodes/GraphNode.java",
          "line_span": null
        },
        {
          "repo_path": "multi_agent_ide_java_parent/multi_agent_ide/src/main/java/com/hayden/multiagentide/model/nodes/ExecutionNode.java",
          "content_hash": "d30bb8d7b6aad4d13d885ed8050321feb246c959",
          "snapshot_path": "multi_agent_ide_java_parent/multi_agent_ide/src/main/java/com/hayden/multiagentide/model/nodes/ExecutionNode.java",
          "line_span": null
        },
        {
          "repo_path": "multi_agent_ide_java_parent/multi_agent_ide/src/main/java/com/hayden/multiagentide/model/nodes/HasChatId.java",
          "content_hash": "2c2a0e940edc64c3827a91f65db87fee052fb454",
          "snapshot_path": "multi_agent_ide_java_parent/multi_agent_ide/src/main/java/com/hayden/multiagentide/model/nodes/HasChatId.java",
          "line_span": null
        }
      ],
      "supersedes": {
        "metadata_file_id": "2026-04-13T20-16-04-e3b0c442",
        "section_path": "$.sections[\"Key-to-Node Mapping\"]"
      }
    }
  ],
  "snapshot_dir": "2026-04-13T20-16-04-e3b0c442.snapshots"
}