{
  "id": "2026-04-13T19-39-50-40c7a82f",
  "created_at": "2026-04-13T19:39:51.019793Z",
  "mental_model": "mental-models.md",
  "scope": "view",
  "owner_name": "utility-module",
  "view_script_hash": "9fd8f360d47a5c14bdf95797dd3202e34b25fbea",
  "diff_entries": [
    {
      "section_path": "$.sections[\"Overview\"]",
      "offset": 0,
      "source_files": [],
      "supersedes": null
    },
    {
      "section_path": "$.sections[\"The Result Type Hierarchy\"]",
      "offset": 0,
      "source_files": [
        {
          "repo_path": "multi_agent_ide_java_parent/utilitymodule/src/main/java/com/hayden/utilitymodule/result/Result.java",
          "content_hash": "446a92ac9312c016108c56d915c954d4a04252c6",
          "snapshot_path": "multi_agent_ide_java_parent/utilitymodule/src/main/java/com/hayden/utilitymodule/result/Result.java",
          "line_span": null
        }
      ],
      "supersedes": null
    },
    {
      "section_path": "$.sections[\"EventBus Contract\"]",
      "offset": 0,
      "source_files": [
        {
          "repo_path": "multi_agent_ide_java_parent/utilitymodule/src/main/java/com/hayden/utilitymodule/Cdc.java",
          "content_hash": "e3e1e57bdba72ad9f151eb461b652cbea6498f4b",
          "snapshot_path": "multi_agent_ide_java_parent/utilitymodule/src/main/java/com/hayden/utilitymodule/Cdc.java",
          "line_span": null
        }
      ],
      "supersedes": null
    },
    {
      "section_path": "$.sections[\"Concurrency Primitives\"]",
      "offset": 0,
      "source_files": [
        {
          "repo_path": "multi_agent_ide_java_parent/utilitymodule/src/main/java/com/hayden/utilitymodule/concurrent/OnceCell.java",
          "content_hash": "1654393d6a239ec4b598aa25fb91d2571f477d0f",
          "snapshot_path": "multi_agent_ide_java_parent/utilitymodule/src/main/java/com/hayden/utilitymodule/concurrent/OnceCell.java",
          "line_span": null
        }
      ],
      "supersedes": null
    },
    {
      "section_path": "$.sections[\"Other Notable Abstractions\"]",
      "offset": 0,
      "source_files": [
        {
          "repo_path": "multi_agent_ide_java_parent/utilitymodule/src/main/java/com/hayden/utilitymodule/ArrayUtilUtilities.java",
          "content_hash": "e8322ad9a4d63c3f015bdce612ce04e3c85f1e8d",
          "snapshot_path": "multi_agent_ide_java_parent/utilitymodule/src/main/java/com/hayden/utilitymodule/ArrayUtilUtilities.java",
          "line_span": null
        }
      ],
      "supersedes": null
    }
  ],
  "snapshot_dir": "2026-04-13T19-39-50-40c7a82f.snapshots"
}