{
  "id": "2026-04-13T19-39-53-40c7a82f",
  "created_at": "2026-04-13T19:39:53.919296Z",
  "mental_model": "mental-models.md",
  "scope": "view",
  "owner_name": "utility-module",
  "view_script_hash": "9fd8f360d47a5c14bdf95797dd3202e34b25fbea",
  "diff_entries": [
    {
      "section_path": "$.sections[\"Overview\"]",
      "offset": 0,
      "source_files": [],
      "supersedes": {
        "metadata_file_id": "2026-04-13T19-39-53-40c7a82f",
        "section_path": "$.sections[\"Overview\"]"
      }
    },
    {
      "section_path": "$.sections[\"The Result Type Hierarchy\"]",
      "offset": 0,
      "source_files": [
        {
          "repo_path": "multi_agent_ide_java_parent/utilitymodule/src/main/java/com/hayden/utilitymodule/result/Result.java",
          "content_hash": "446a92ac9312c016108c56d915c954d4a04252c6",
          "snapshot_path": "multi_agent_ide_java_parent/utilitymodule/src/main/java/com/hayden/utilitymodule/result/Result.java",
          "line_span": null
        },
        {
          "repo_path": "multi_agent_ide_java_parent/utilitymodule/src/main/java/com/hayden/utilitymodule/result/AsyncResult.java",
          "content_hash": "9aa6dda33016684c9ab894bdda755f83a9645992",
          "snapshot_path": "multi_agent_ide_java_parent/utilitymodule/src/main/java/com/hayden/utilitymodule/result/AsyncResult.java",
          "line_span": null
        },
        {
          "repo_path": "multi_agent_ide_java_parent/utilitymodule/src/main/java/com/hayden/utilitymodule/result/ClosableResult.java",
          "content_hash": "ebcb4d6aefb7f8d32296ab12f7d9a4ef7da373db",
          "snapshot_path": "multi_agent_ide_java_parent/utilitymodule/src/main/java/com/hayden/utilitymodule/result/ClosableResult.java",
          "line_span": null
        },
        {
          "repo_path": "multi_agent_ide_java_parent/utilitymodule/src/main/java/com/hayden/utilitymodule/result/ManyResult.java",
          "content_hash": "9166446cb685ed81cd28da86549deee4913136c7",
          "snapshot_path": "multi_agent_ide_java_parent/utilitymodule/src/main/java/com/hayden/utilitymodule/result/ManyResult.java",
          "line_span": null
        },
        {
          "repo_path": "multi_agent_ide_java_parent/utilitymodule/src/main/java/com/hayden/utilitymodule/result/MutableResult.java",
          "content_hash": "01eb324f4882c20173af81081e9da2778e585c97",
          "snapshot_path": "multi_agent_ide_java_parent/utilitymodule/src/main/java/com/hayden/utilitymodule/result/MutableResult.java",
          "line_span": null
        },
        {
          "repo_path": "multi_agent_ide_java_parent/utilitymodule/src/main/java/com/hayden/utilitymodule/result/OneResult.java",
          "content_hash": "9b804b6652dbb8d2abb18ec185f106b0581d01c4",
          "snapshot_path": "multi_agent_ide_java_parent/utilitymodule/src/main/java/com/hayden/utilitymodule/result/OneResult.java",
          "line_span": null
        },
        {
          "repo_path": "multi_agent_ide_java_parent/utilitymodule/src/main/java/com/hayden/utilitymodule/result/agg/Agg.java",
          "content_hash": "c182df9131536cf7def9f859628e2b19a6c2273e",
          "snapshot_path": "multi_agent_ide_java_parent/utilitymodule/src/main/java/com/hayden/utilitymodule/result/agg/Agg.java",
          "line_span": null
        },
        {
          "repo_path": "multi_agent_ide_java_parent/utilitymodule/src/main/java/com/hayden/utilitymodule/result/agg/AggregateError.java",
          "content_hash": "1755d1f90a7774e426e9c6a62a681c801dcea660",
          "snapshot_path": "multi_agent_ide_java_parent/utilitymodule/src/main/java/com/hayden/utilitymodule/result/agg/AggregateError.java",
          "line_span": null
        },
        {
          "repo_path": "multi_agent_ide_java_parent/utilitymodule/src/main/java/com/hayden/utilitymodule/result/agg/AggregateParamError.java",
          "content_hash": "680a9c440570d06c15dce611e97353c4b45c02c0",
          "snapshot_path": "multi_agent_ide_java_parent/utilitymodule/src/main/java/com/hayden/utilitymodule/result/agg/AggregateParamError.java",
          "line_span": null
        },
        {
          "repo_path": "multi_agent_ide_java_parent/utilitymodule/src/main/java/com/hayden/utilitymodule/result/agg/Responses.java",
          "content_hash": "3e849924120a0a532cafa1ecd43f88105959db74",
          "snapshot_path": "multi_agent_ide_java_parent/utilitymodule/src/main/java/com/hayden/utilitymodule/result/agg/Responses.java",
          "line_span": null
        },
        {
          "repo_path": "multi_agent_ide_java_parent/utilitymodule/src/main/java/com/hayden/utilitymodule/result/async/CompletableFutureResult.java",
          "content_hash": "f673c2875527ce208aa7575083255ad28b66cad6",
          "snapshot_path": "multi_agent_ide_java_parent/utilitymodule/src/main/java/com/hayden/utilitymodule/result/async/CompletableFutureResult.java",
          "line_span": null
        },
        {
          "repo_path": "multi_agent_ide_java_parent/utilitymodule/src/main/java/com/hayden/utilitymodule/result/async/FluxResult.java",
          "content_hash": "34bf6bc4bb495a750454a19065d481e897e35b14",
          "snapshot_path": "multi_agent_ide_java_parent/utilitymodule/src/main/java/com/hayden/utilitymodule/result/async/FluxResult.java",
          "line_span": null
        },
        {
          "repo_path": "multi_agent_ide_java_parent/utilitymodule/src/main/java/com/hayden/utilitymodule/result/async/IAsyncManyResultItem.java",
          "content_hash": "390221e38f35d9a7c8b10cd77eb0dd7cb6622bc8",
          "snapshot_path": "multi_agent_ide_java_parent/utilitymodule/src/main/java/com/hayden/utilitymodule/result/async/IAsyncManyResultItem.java",
          "line_span": null
        },
        {
          "repo_path": "multi_agent_ide_java_parent/utilitymodule/src/main/java/com/hayden/utilitymodule/result/async/IAsyncResultItem.java",
          "content_hash": "8fe7ab0883f5208fd75a5ffc2ca475819be44c75",
          "snapshot_path": "multi_agent_ide_java_parent/utilitymodule/src/main/java/com/hayden/utilitymodule/result/async/IAsyncResultItem.java",
          "line_span": null
        },
        {
          "repo_path": "multi_agent_ide_java_parent/utilitymodule/src/main/java/com/hayden/utilitymodule/result/async/MonoResult.java",
          "content_hash": "5ee7e0c37a9285e6133f9be67621140d04c04d3c",
          "snapshot_path": "multi_agent_ide_java_parent/utilitymodule/src/main/java/com/hayden/utilitymodule/result/async/MonoResult.java",
          "line_span": null
        },
        {
          "repo_path": "multi_agent_ide_java_parent/utilitymodule/src/main/java/com/hayden/utilitymodule/result/closable/ClosableMonitor.java",
          "content_hash": "7eeb2f0e3bdba77a8565ee7e941d269cf1f7022b",
          "snapshot_path": "multi_agent_ide_java_parent/utilitymodule/src/main/java/com/hayden/utilitymodule/result/closable/ClosableMonitor.java",
          "line_span": null
        },
        {
          "repo_path": "multi_agent_ide_java_parent/utilitymodule/src/main/java/com/hayden/utilitymodule/result/error/BindingResultErr.java",
          "content_hash": "b3fa2606be24f40320428cf54249f2b99e7e10c7",
          "snapshot_path": "multi_agent_ide_java_parent/utilitymodule/src/main/java/com/hayden/utilitymodule/result/error/BindingResultErr.java",
          "line_span": null
        }
      ],
      "supersedes": {
        "metadata_file_id": "2026-04-13T19-39-53-40c7a82f",
        "section_path": "$.sections[\"The Result Type Hierarchy\"]"
      }
    },
    {
      "section_path": "$.sections[\"EventBus Contract\"]",
      "offset": 0,
      "source_files": [
        {
          "repo_path": "multi_agent_ide_java_parent/utilitymodule/src/main/java/com/hayden/utilitymodule/Cdc.java",
          "content_hash": "e3e1e57bdba72ad9f151eb461b652cbea6498f4b",
          "snapshot_path": "multi_agent_ide_java_parent/utilitymodule/src/main/java/com/hayden/utilitymodule/Cdc.java",
          "line_span": null
        }
      ],
      "supersedes": {
        "metadata_file_id": "2026-04-13T19-39-53-40c7a82f",
        "section_path": "$.sections[\"EventBus Contract\"]"
      }
    },
    {
      "section_path": "$.sections[\"Concurrency Primitives\"]",
      "offset": 0,
      "source_files": [
        {
          "repo_path": "multi_agent_ide_java_parent/utilitymodule/src/main/java/com/hayden/utilitymodule/concurrent/OnceCell.java",
          "content_hash": "1654393d6a239ec4b598aa25fb91d2571f477d0f",
          "snapshot_path": "multi_agent_ide_java_parent/utilitymodule/src/main/java/com/hayden/utilitymodule/concurrent/OnceCell.java",
          "line_span": null
        }
      ],
      "supersedes": {
        "metadata_file_id": "2026-04-13T19-39-53-40c7a82f",
        "section_path": "$.sections[\"Concurrency Primitives\"]"
      }
    },
    {
      "section_path": "$.sections[\"Other Notable Abstractions\"]",
      "offset": 0,
      "source_files": [
        {
          "repo_path": "multi_agent_ide_java_parent/utilitymodule/src/main/java/com/hayden/utilitymodule/ArrayUtilUtilities.java",
          "content_hash": "e8322ad9a4d63c3f015bdce612ce04e3c85f1e8d",
          "snapshot_path": "multi_agent_ide_java_parent/utilitymodule/src/main/java/com/hayden/utilitymodule/ArrayUtilUtilities.java",
          "line_span": null
        }
      ],
      "supersedes": {
        "metadata_file_id": "2026-04-13T19-39-53-40c7a82f",
        "section_path": "$.sections[\"Other Notable Abstractions\"]"
      }
    }
  ],
  "snapshot_dir": "2026-04-13T19-39-53-40c7a82f.snapshots"
}