{
  "id": "2026-04-13T19-38-01-a8751154",
  "created_at": "2026-04-13T19:38:02.027126Z",
  "mental_model": "mental-models.md",
  "scope": "view",
  "owner_name": "agent-framework",
  "view_script_hash": "88612fdbd6009524f0bc022f08df8306a230ec5c",
  "diff_entries": [
    {
      "section_path": "$.sections[\"Overview\"]",
      "offset": 0,
      "source_files": [],
      "supersedes": {
        "metadata_file_id": "2026-04-13T19-38-01-a8751154",
        "section_path": "$.sections[\"Overview\"]"
      }
    },
    {
      "section_path": "$.sections[\"Embabel Integration\"]",
      "offset": 0,
      "source_files": [
        {
          "repo_path": "multi_agent_ide_java_parent/multi_agent_ide/src/main/java/com/hayden/multiagentide/embabel/EmbabelUtil.java",
          "content_hash": "4043a1921225bd30c37ae4b6304653c862029b49",
          "snapshot_path": "multi_agent_ide_java_parent/multi_agent_ide/src/main/java/com/hayden/multiagentide/embabel/EmbabelUtil.java",
          "line_span": null
        },
        {
          "repo_path": "multi_agent_ide_java_parent/multi_agent_ide/src/main/java/com/hayden/multiagentide/agent/AgentLifecycleHandler.java",
          "content_hash": "910fca049ced19c1f37cfa8f138e671649f0f566",
          "snapshot_path": "multi_agent_ide_java_parent/multi_agent_ide/src/main/java/com/hayden/multiagentide/agent/AgentLifecycleHandler.java",
          "line_span": null
        },
        {
          "repo_path": "multi_agent_ide_java_parent/multi_agent_ide/src/main/java/com/hayden/multiagentide/agent/AgentContext.java",
          "content_hash": "f97da92852aa4d92ffddf453724d2df1d6a61280",
          "snapshot_path": "multi_agent_ide_java_parent/multi_agent_ide/src/main/java/com/hayden/multiagentide/agent/AgentContext.java",
          "line_span": null
        },
        {
          "repo_path": "multi_agent_ide_java_parent/multi_agent_ide/src/main/java/com/hayden/multiagentide/config/MultiAgentEmbabelConfig.java",
          "content_hash": "f262d2fad18c7ae0e677f04b1fb9b486e262d481",
          "snapshot_path": "multi_agent_ide_java_parent/multi_agent_ide/src/main/java/com/hayden/multiagentide/config/MultiAgentEmbabelConfig.java",
          "line_span": null
        },
        {
          "repo_path": "multi_agent_ide_java_parent/acp-cdc-ai/src/main/kotlin/com/hayden/acp_cdc_ai/acp/AcpChatModel.kt",
          "content_hash": "ccb648e8c3433959bc4eeebf758c02247301ff0c",
          "snapshot_path": "multi_agent_ide_java_parent/acp-cdc-ai/src/main/kotlin/com/hayden/acp_cdc_ai/acp/AcpChatModel.kt",
          "line_span": null
        },
        {
          "repo_path": "multi_agent_ide_java_parent/acp-cdc-ai/src/main/kotlin/com/hayden/acp_cdc_ai/acp/AcpSessionManager.kt",
          "content_hash": "04fc5676bca64dc1354155a7b9c662fadd741d6a",
          "snapshot_path": "multi_agent_ide_java_parent/acp-cdc-ai/src/main/kotlin/com/hayden/acp_cdc_ai/acp/AcpSessionManager.kt",
          "line_span": null
        },
        {
          "repo_path": "multi_agent_ide_java_parent/acp-cdc-ai/src/main/java/com/hayden/acp_cdc_ai/acp/config/AcpModelProperties.java",
          "content_hash": "acb2d4a4854a83b9a04562b2cc436c4e3e0f7ccb",
          "snapshot_path": "multi_agent_ide_java_parent/acp-cdc-ai/src/main/java/com/hayden/acp_cdc_ai/acp/config/AcpModelProperties.java",
          "line_span": null
        }
      ],
      "supersedes": {
        "metadata_file_id": "2026-04-13T19-38-01-a8751154",
        "section_path": "$.sections[\"Embabel Integration\"]"
      }
    },
    {
      "section_path": "$.sections[\"Agent Type System\"]",
      "offset": 0,
      "source_files": [
        {
          "repo_path": "multi_agent_ide_java_parent/multi_agent_ide/src/main/java/com/hayden/multiagentide/agent/AgentType.java",
          "content_hash": "de0cdd4c04582457061edcacc4770e28e4f23ee6",
          "snapshot_path": "multi_agent_ide_java_parent/multi_agent_ide/src/main/java/com/hayden/multiagentide/agent/AgentType.java",
          "line_span": null
        },
        {
          "repo_path": "multi_agent_ide_java_parent/multi_agent_ide/src/main/java/com/hayden/multiagentide/agent/AgentInterfaces.java",
          "content_hash": "83c266ec7a42893718956b2abeefb794f552a995",
          "snapshot_path": "multi_agent_ide_java_parent/multi_agent_ide/src/main/java/com/hayden/multiagentide/agent/AgentInterfaces.java",
          "line_span": null
        },
        {
          "repo_path": "multi_agent_ide_java_parent/multi_agent_ide/src/main/java/com/hayden/multiagentide/agent/AgentModels.java",
          "content_hash": "21f8b9539ca6e13377b74b532387e852f3770716",
          "snapshot_path": "multi_agent_ide_java_parent/multi_agent_ide/src/main/java/com/hayden/multiagentide/agent/AgentModels.java",
          "line_span": null
        }
      ],
      "supersedes": {
        "metadata_file_id": "2026-04-13T19-38-01-a8751154",
        "section_path": "$.sections[\"Agent Type System\"]"
      }
    },
    {
      "section_path": "$.sections[\"Tool System\"]",
      "offset": 0,
      "source_files": [
        {
          "repo_path": "multi_agent_ide_java_parent/multi_agent_ide/src/main/java/com/hayden/multiagentide/tool/ToolAbstraction.java",
          "content_hash": "b317fdd1e92fd7147848756410f7e0de4846629a",
          "snapshot_path": "multi_agent_ide_java_parent/multi_agent_ide/src/main/java/com/hayden/multiagentide/tool/ToolAbstraction.java",
          "line_span": null
        }
      ],
      "supersedes": {
        "metadata_file_id": "2026-04-13T19-38-01-a8751154",
        "section_path": "$.sections[\"Tool System\"]"
      }
    },
    {
      "section_path": "$.sections[\"ToolAbstraction: The Unified Wrapper\"]",
      "offset": 0,
      "source_files": [],
      "supersedes": {
        "metadata_file_id": "2026-04-13T19-38-01-a8751154",
        "section_path": "$.sections[\"ToolAbstraction: The Unified Wrapper\"]"
      }
    },
    {
      "section_path": "$.sections[\"Three Tool Carrier Beans\"]",
      "offset": 0,
      "source_files": [],
      "supersedes": {
        "metadata_file_id": "2026-04-13T19-38-01-a8751154",
        "section_path": "$.sections[\"Three Tool Carrier Beans\"]"
      }
    },
    {
      "section_path": "$.sections[\"EmbabelToolObjectRegistry\"]",
      "offset": 0,
      "source_files": [],
      "supersedes": {
        "metadata_file_id": "2026-04-13T19-38-01-a8751154",
        "section_path": "$.sections[\"EmbabelToolObjectRegistry\"]"
      }
    },
    {
      "section_path": "$.sections[\"LLM Runner: Template to ACP Call\"]",
      "offset": 0,
      "source_files": [
        {
          "repo_path": "multi_agent_ide_java_parent/multi_agent_ide/src/main/java/com/hayden/multiagentide/llm/AgentLlmExecutor.java",
          "content_hash": "31ce69e0867224c2f1c44a7046fb43d4277cc116",
          "snapshot_path": "multi_agent_ide_java_parent/multi_agent_ide/src/main/java/com/hayden/multiagentide/llm/AgentLlmExecutor.java",
          "line_span": null
        }
      ],
      "supersedes": {
        "metadata_file_id": "2026-04-13T19-38-01-a8751154",
        "section_path": "$.sections[\"LLM Runner: Template to ACP Call\"]"
      }
    },
    {
      "section_path": "$.sections[\"Skill System\"]",
      "offset": 0,
      "source_files": [
        {
          "repo_path": "multi_agent_ide_java_parent/multi_agent_ide/src/main/java/com/hayden/multiagentide/skills/SkillFinder.java",
          "content_hash": "19fc302d072dcf859bdf3df98b08904edb751604",
          "snapshot_path": "multi_agent_ide_java_parent/multi_agent_ide/src/main/java/com/hayden/multiagentide/skills/SkillFinder.java",
          "line_span": null
        }
      ],
      "supersedes": {
        "metadata_file_id": "2026-04-13T19-38-01-a8751154",
        "section_path": "$.sections[\"Skill System\"]"
      }
    },
    {
      "section_path": "$.sections[\"Episodic Memory\"]",
      "offset": 0,
      "source_files": [],
      "supersedes": {
        "metadata_file_id": "2026-04-13T19-38-01-a8751154",
        "section_path": "$.sections[\"Episodic Memory\"]"
      }
    }
  ],
  "snapshot_dir": "2026-04-13T19-38-01-a8751154.snapshots"
}