{
  "id": "2026-04-13T19-39-25-c6050403",
  "created_at": "2026-04-13T19:39:25.989683Z",
  "mental_model": "mental-models.md",
  "scope": "view",
  "owner_name": "persistence",
  "view_script_hash": "00e45be40ad8ad8453a9921cffd37e7baa0effd6",
  "diff_entries": [
    {
      "section_path": "$.sections[\"Overview\"]",
      "offset": 0,
      "source_files": [],
      "supersedes": {
        "metadata_file_id": "2026-04-13T19-39-25-c6050403",
        "section_path": "$.sections[\"Overview\"]"
      }
    },
    {
      "section_path": "$.sections[\"Two-Tier Architecture\"]",
      "offset": 0,
      "source_files": [
        {
          "repo_path": "multi_agent_ide_java_parent/multi_agent_ide/src/main/java/com/hayden/multiagentide/repository/GraphRepository.java",
          "content_hash": "56783c5269fbb66e24e2e5967186207cc833a97b",
          "snapshot_path": "multi_agent_ide_java_parent/multi_agent_ide/src/main/java/com/hayden/multiagentide/repository/GraphRepository.java",
          "line_span": null
        },
        {
          "repo_path": "multi_agent_ide_java_parent/multi_agent_ide/src/main/java/com/hayden/multiagentide/repository/InMemoryGraphRepository.java",
          "content_hash": "18d9374511fca116c560251fd688564ca90c5a45",
          "snapshot_path": "multi_agent_ide_java_parent/multi_agent_ide/src/main/java/com/hayden/multiagentide/repository/InMemoryGraphRepository.java",
          "line_span": null
        },
        {
          "repo_path": "multi_agent_ide_java_parent/multi_agent_ide/src/main/java/com/hayden/multiagentide/repository/EventStreamRepository.java",
          "content_hash": "f420e91f4d11726a188abd8d93b320675b8dc712",
          "snapshot_path": "multi_agent_ide_java_parent/multi_agent_ide/src/main/java/com/hayden/multiagentide/repository/EventStreamRepository.java",
          "line_span": null
        }
      ],
      "supersedes": {
        "metadata_file_id": "2026-04-13T19-39-25-c6050403",
        "section_path": "$.sections[\"Two-Tier Architecture\"]"
      }
    },
    {
      "section_path": "$.sections[\"Artifact Persistence Flow\"]",
      "offset": 0,
      "source_files": [
        {
          "repo_path": "multi_agent_ide_java_parent/multi_agent_ide/src/main/java/com/hayden/multiagentide/artifacts/ArtifactEmissionService.java",
          "content_hash": "88fc5d495cfe2230e8c6735267a305c2accceba2",
          "snapshot_path": "multi_agent_ide_java_parent/multi_agent_ide/src/main/java/com/hayden/multiagentide/artifacts/ArtifactEmissionService.java",
          "line_span": null
        }
      ],
      "supersedes": {
        "metadata_file_id": "2026-04-13T19-39-25-c6050403",
        "section_path": "$.sections[\"Artifact Persistence Flow\"]"
      }
    },
    {
      "section_path": "$.sections[\"ArtifactKey: The Hierarchical Identifier\"]",
      "offset": 0,
      "source_files": [],
      "supersedes": {
        "metadata_file_id": "2026-04-13T19-39-25-c6050403",
        "section_path": "$.sections[\"ArtifactKey: The Hierarchical Identifier\"]"
      }
    },
    {
      "section_path": "$.sections[\"SemanticRepresentation: Post-Hoc Enrichment\"]",
      "offset": 0,
      "source_files": [],
      "supersedes": {
        "metadata_file_id": "2026-04-13T19-39-25-c6050403",
        "section_path": "$.sections[\"SemanticRepresentation: Post-Hoc Enrichment\"]"
      }
    },
    {
      "section_path": "$.sections[\"Direct Persistence Bypass\"]",
      "offset": 0,
      "source_files": [
        {
          "repo_path": "multi_agent_ide_java_parent/multi_agent_ide/src/main/java/com/hayden/multiagentide/artifacts/PolicyLifecycleArtifactService.java",
          "content_hash": "569445c57dd1d4b83955f7148258b71f59b73618",
          "snapshot_path": "multi_agent_ide_java_parent/multi_agent_ide/src/main/java/com/hayden/multiagentide/artifacts/PolicyLifecycleArtifactService.java",
          "line_span": null
        }
      ],
      "supersedes": {
        "metadata_file_id": "2026-04-13T19-39-25-c6050403",
        "section_path": "$.sections[\"Direct Persistence Bypass\"]"
      }
    }
  ],
  "snapshot_dir": "2026-04-13T19-39-25-c6050403.snapshots"
}